{
  "schemaVersion": 3,
  "repository": {
    "owner": "emmanueltremblay9-stack",
    "name": "Immersive-BOP_Harvest"
  },
  "baseline": {
    "mode": "previousPublicFile",
    "previousPublicFileId": 8426397,
    "releaseType": "alpha",
    "gameVersionNames": [
      "Client",
      "1.21.1",
      "NeoForge"
    ],
    "previousFileRelations": [
      {
        "projectId": 220318,
        "slug": "biomes-o-plenty",
        "type": "RequiredDependency"
      },
      {
        "projectId": 398521,
        "slug": "farmers-delight",
        "type": "RequiredDependency"
      },
      {
        "projectId": 231951,
        "slug": "immersive-engineering",
        "type": "RequiredDependency"
      }
    ],
    "projectRelations": []
  },
  "release": {
    "tag": "v0.1.1",
    "version": "0.1.1",
    "modId": "immersive_bop_harvest",
    "assetName": "immersive_bop_harvest-0.1.1.jar",
    "assetSize": 1606577,
    "assetSha256": "edcedc52d8b0fc2952bcffb7c54f3737ed144227350a5b46ea71620dd3859394",
    "changelogPath": "docs/release/0.1.1.md",
    "changelogSha256": "8f1ba9eb9161a282bafdbcb2b89fafc68da1fd6cc4e798c013c08fd3aac6e1c8"
  },
  "curseforge": {
    "projectId": 1609013,
    "projectSlug": "immersive-bop-harvest",
    "displayName": "immersive_bop_harvest-0.1.1.jar",
    "releaseType": "release",
    "isMarkedForManualRelease": false,
    "gameVersionNames": [
      "Client",
      "Server",
      "1.21.1",
      "NeoForge"
    ],
    "gameVersionLookupNames": [
      "1.21.1"
    ],
    "uploadRelations": [
      {
        "projectID": 220318,
        "slug": "biomes-o-plenty",
        "type": "requiredDependency"
      },
      {
        "projectID": 955399,
        "slug": "glitchcore",
        "type": "requiredDependency"
      },
      {
        "projectID": 940057,
        "slug": "terrablender-neoforge",
        "type": "requiredDependency"
      },
      {
        "projectID": 398521,
        "slug": "farmers-delight",
        "type": "requiredDependency"
      },
      {
        "projectID": 231951,
        "slug": "immersive-engineering",
        "type": "requiredDependency"
      }
    ],
    "expectedPublicRelations": [
      {
        "projectId": 220318,
        "slug": "biomes-o-plenty",
        "type": "RequiredDependency"
      },
      {
        "projectId": 955399,
        "slug": "glitchcore",
        "type": "RequiredDependency"
      },
      {
        "projectId": 940057,
        "slug": "terrablender-neoforge",
        "type": "RequiredDependency"
      },
      {
        "projectId": 398521,
        "slug": "farmers-delight",
        "type": "RequiredDependency"
      },
      {
        "projectId": 231951,
        "slug": "immersive-engineering",
        "type": "RequiredDependency"
      }
    ]
  }
}
